id,item_uuid,name,price,description,image,ingredient,genre,store,country
139,l552087_1,贅沢厚切りハムカツ,173,贅沢に厚切りしたハムのしっかりとした食感とうまみが楽しめます。微粉パン粉で薄衣に仕上げました。,https://www.lawson.co.jp/recommend/original/detail/img/l552087_1.png,ハム,カツ,LAWSON,日本
140,n503714,ふっくらあじフライ,162,船内凍結したあじを薄衣で仕立て、素材の美味しさを活かした、あじフライです。,https://www.lawson.co.jp/recommend/original/detail/img/n503714.png,アジ,揚げ物,LAWSON,日本
141,l663090,フライドフィッシュ,160,手軽におさかなを食べられるスティックタイプ。何もつけずにおいしいスパイス仕立てです。,https://www.lawson.co.jp/recommend/original/detail/img/l663090.png,魚,揚げ物,LAWSON,日本
142,l552009_1,イカから揚げ,232,漁獲後に船内で急速凍結した、鮮度にこだわった「イカから」です。ゲソとリングをミックスし、食感の違いを味わえます。,https://www.lawson.co.jp/recommend/original/detail/img/l552009_1.png,イカ,揚げ物,LAWSON,日本
143,l638755_2,北海道小豆のこしあんまん,138,小豆の風味が良い北海道小豆を使用。こしあんの甘さを抑えることにより、小豆の風味がより引き立ち、上品な味わいに仕上げました。,https://www.lawson.co.jp/recommend/original/detail/img/l638755_2.png,小豆,デザート,LAWSON,日本
144,l638848,とろーりチーズとトマトの\r\nピザまん,149,トマトとチーズの配合を見直しバランス良く仕上げました。あらごしトマトと香辛料(オレガノ、ニンニク)でフレッシュ感を引き立て、とろーりチーズと合わせました。,https://www.lawson.co.jp/recommend/original/detail/img/l638848.png,トマト,中華まん,LAWSON,日本
145,l638847,肉の旨みあふれる\r\nジューシー肉まん,149,豚脂を増やしジューシー感アップ。ダイス肉とミンチ肉を合わせ、最後まで肉の旨みを感じられます。和風だしにオイスターソースを加え、濃厚なコクと旨みを付与しました。,https://www.lawson.co.jp/recommend/original/detail/img/l638847.png,豚肉,中華まん,LAWSON,日本
146,l691315,北海道小豆のごまあんまん,138,小豆の風味が良い北海道小豆を使用。ごまあんの甘さを抑えることにより、ごまの風味がより引き立ち、上品な味わいに仕上げました。,https://www.lawson.co.jp/recommend/original/detail/img/l691315.png,小豆,デザート,LAWSON,日本
147,l638849,北海道十勝小豆の\r\nつぶあんまん,138,粒残りが良く、風味の良い北海道十勝小豆を使用。純度が高く上品な甘さの白ざら糖を使用し、すっきりとしたキレの良い甘さに仕上げました。,https://www.lawson.co.jp/recommend/original/detail/img/l638849.png,小豆,デザート,LAWSON,日本
201,0253116,ファミチキ,180,サクサクッとした衣の食感と、柔らかくてジューシーな鶏肉の旨みが楽しめます。食べやすい骨なしタイプです。,https://www.family.co.jp/content/dam/family/goods/0253116.jpg,鶏肉,フライドチキン,FamilyMart,日本
202,0253925,アメリカンドッグ,118,程よい甘さで、ふんわりした衣が特徴のアメリカンドッグです。,https://www.family.co.jp/content/dam/family/goods/0253925.jpg,豚肉,フランク,FamilyMart,日本
203,0254489,ジャンボフランク,168,ドイツ産岩塩で肉の旨みを引き出した食べごたえある大きなサイズのフランクフルトです。,https://www.family.co.jp/content/dam/family/goods/0254489.jpg,豚肉,フランク,FamilyMart,日本
204,0250009,鶏つくね串,140,鶏肉に玉ねぎと鶏皮を入れたジューシーでふんわりしたつくね串です。,https://www.family.co.jp/content/dam/family/goods/0250009.jpg,鶏肉,焼き鳥,FamilyMart,日本
205,0252867,ハッシュドポテト,108,ホクホクしたザク切りポテトを使用し、具材感ある仕立てにしました。,https://www.family.co.jp/content/dam/family/goods/0252867.jpg,じゃがいも,ポテト,FamilyMart,日本
206,0254755,厚切りハムカツ,138,軽い食感の衣に旨みのある厚切りハムを組み合わせ、ボリューム感のあるハムカツに仕上げました。おかずにもおやつにもなるハムカツです。,https://www.family.co.jp/content/dam/family/goods/0254755.jpg,ハム,カツ,FamilyMart,日本
207,0251730,ジューシーメンチカツ,138,ザクザク衣と肉汁がジュワっとあふれるジューシーなメンチカツです。,https://www.family.co.jp/content/dam/family/goods/0251730.jpg,豚肉,カツ,FamilyMart,日本
208,0253352,炭火焼きとり　もも塩,108,炭火で焼いた鶏のもも肉を、五島灘産の海水塩に北海道産昆布の粉末を加えた特製の塩で仕上げました。おかずにもおつまみにもぴったりな焼きとりです。,https://www.family.co.jp/content/dam/family/goods/0253352.jpg,鶏肉,焼き鳥,FamilyMart,日本
209,0251013,ファミから（塩）1個,98,2種類の塩と3種類のだしを使用し、ごはんのおかずにもおつまみにも合う大粒サイズのからあげです。　,https://www.family.co.jp/content/dam/family/goods/0251013.jpg,鶏肉,からあげ,FamilyMart,日本
210,0250160,ファミから（醤油）1個,98,3種類の醤油を使用し、ごはんのおかずにもおつまみにも合う大粒サイズのからあげです。　,https://www.family.co.jp/content/dam/family/goods/0250160.jpg,鶏肉,からあげ,FamilyMart,日本
211,0250399,炭火焼きとりかわ塩,108,炭火で焼いた鶏のかわを、五島灘の海水塩に北海道産昆布の粉末を加えた特製の塩で仕上げました。おかずにもおつまみにもぴったりな焼きとりです。,https://www.family.co.jp/content/dam/family/goods/0250399.jpg,鶏肉,焼き鳥,FamilyMart,日本
212,0257688,クリスピーチキン\r\n（亀田のカレーせん味）,160,亀田製菓の「亀田のカレーせん」の味を再現した、夏にぴったりの旨辛スパイシーな味わいのクリスピーチキンです。［数量限定］,https://www.family.co.jp/content/dam/family/goods/0257688.jpg,鶏肉,揚げ物,FamilyMart,日本
213,0257701,北海道十勝産コーンの\r\nクリームコロッケ,128,北海道十勝産のとうもろこしを使用したコーンクリームコロッケです。とうもろこしの甘みと食感が感じられる商品です。［数量限定］,https://www.family.co.jp/content/dam/family/goods/0257701.jpg,コーン,コロッケ,FamilyMart,日本
214,0254465,クリスピーチキン\r\n（ハバネロホット）,160,さっぱりとした鶏むね肉にクリスピーな衣の食感が特徴です。味付けに用いる唐辛子にはハバネロも配合し、刺激がたまらない逸品に仕上げました。,https://www.family.co.jp/content/dam/family/goods/0254465.jpg,鶏肉,揚げ物,FamilyMart,日本
215,0254793,ファミチキ\r\n（ハバネロホット）,198,「ハバネロ」を使用した刺激的な辛さがやみつきになる、辛い物好きの方にオススメの辛旨ファミチキです。［数量限定］,https://www.family.co.jp/content/dam/family/goods/0254793.jpg,鶏肉,フライドチキン,FamilyMart,日本
216,0254540,炭火焼きとりかわタレ,108,炭火で焼いた鶏のかわを、4種の醤油を使用したタレで仕上げました。おかずにもおつまみにもぴったりな焼きとりです。,https://www.family.co.jp/content/dam/family/goods/0254540.jpg,鶏肉,焼き鳥,FamilyMart,日本
217,0253154,炭火焼きとりぼんじりタレ,128,プリッとした食感と脂の旨みが特徴のぼんじりを、4種の醤油を使用したこだわりのタレで仕上げました。［数量限定］,https://www.family.co.jp/content/dam/family/goods/0253154.jpg,鶏肉,焼き鳥,FamilyMart,日本
218,0252355,照焼チキンステーキ,220,ジューシーな鶏もも肉を醤油とみりんのきいた照焼タレで焼き上げたチキンステーキです。,https://www.family.co.jp/content/dam/family/goods/0252355.jpg,鶏肉,変わり種,FamilyMart,日本
219,0255332,カニクリームコロッケ,128,北海道産牛乳を使用しました。カニの風味とミルクのクリーミーさを感じられる、なめらかな食感のカニクリームコロッケです。［数量限定］,https://www.family.co.jp/content/dam/family/goods/0255332.jpg,かに,コロッケ,FamilyMart,日本
220,0250948,炭火焼きとり　ももタレ,108,炭火で焼いた鶏のもも肉を、4種の醤油を使用したこだわりのタレで仕上げました。おかずにもおつまみにもぴったりな焼きとりです。,https://www.family.co.jp/content/dam/family/goods/0250948.jpg,鶏肉,焼き鳥,FamilyMart,日本
221,0254458,クリスピーチキン\r\n（プレーン）,160,さっぱりとした鶏むね肉にクリスピーな衣の食感が特徴です。醤油とにんにくを使ったシンプルな味つけながらも、次の一口が欲しくなるクセになる逸品です。,https://www.family.co.jp/content/dam/family/goods/0254458.jpg,鶏肉,揚げ物,FamilyMart,日本
222,0253918,ファミコロ（牛肉コロッケ）,88,じゃがいもの食感と牛肉の旨みを感じるコロッケです。,https://www.family.co.jp/content/dam/family/goods/0253918.jpg,牛肉,コロッケ,FamilyMart,日本
223,0252102,スパイシーチキン,160,やみつきになるスパイシーな味付けのフライドチキンです。,https://www.family.co.jp/content/dam/family/goods/0252102.jpg,鶏肉,フライドチキン,FamilyMart,日本
224,0240444,麻辣チーズ肉まん,130,チーズのマイルドさと痺れる辛さと旨みがやみつきになる肉まんです。コチジャンにXO醤を加え、山椒、唐辛子で味付けしました。チーズは伸びのモッツァレラとコクのゴーダとパルメザンを使用しています。［数量限定］,https://www.family.co.jp/content/dam/family/goods/0240444.jpg,チーズ,中華まん,FamilyMart,日本
225,0240512,北海道産小豆の\r\nこしあんまん（ごま風味）,130,北海道産小豆と沖縄県産黒糖を使用した黒糖蜜であんのコクをだし、生地はふんわりしっとり生地が特徴です。,https://www.family.co.jp/content/dam/family/goods/0240512.jpg,小豆,デザート,FamilyMart,日本
226,0240529,ジューシー本格肉まん,140,噛めばかむほど旨み際立つ生地と豚肉のじゅわっと広がる餡がお楽しみいただけます。 味付けはホタテ貝柱だしと中華スープを使用し、本格中華仕立ての逸品です。,https://www.family.co.jp/content/dam/family/goods/0240529.jpg,豚肉,中華まん,FamilyMart,日本
227,0240536,とろ～りチーズの\r\n濃厚ピザまん,140,4種のチーズを使用し、伸びが特徴のモッツァレラチーズはそのままに旨みが特徴のカマンベールチーズを新しく加えました。トマトのソースは甘味とフレッシュ感が特徴の完熟トマトを使用しました。生地は旨みのあるふんわり生地が特徴です。,https://www.family.co.jp/content/dam/family/goods/0240536.jpg,トマト,中華まん,FamilyMart,日本
228,0240543,スパイス香る\r\nキーマカレーまん,140,スパイスは特選スパイスを18種類オリジナル配合しました。鶏むね肉を使い、野菜の旨みとココナッツミルクパウダーを使用したコクとスパイスがクセになる味わいです。［数量限定］,https://www.family.co.jp/content/dam/family/goods/0240543.jpg,キーマ,中華まん,FamilyMart,日本
229,0240505,北海道産大納言小豆の\r\nつぶあんまん,130,通常より大粒な大納言小豆を100％使用し、粒感をお楽しみいただける仕立てで生地はしっとり口どけがよい生地が特徴です。,https://www.family.co.jp/content/dam/family/goods/0240505.jpg,小豆,デザート,FamilyMart,日本